[
    {
        "id": 1,
        "schema1": {
            "$ref": "https://json-schema.org/draft/future/schema"
        },
        "schema2": {
            "$ref": "https://json-schema.org/draft/future/schema"
        },
        "tests": {
            "s1SubsetEqOfs2": true,
            "s2SubsetEqOfs1": true
        }
    }
]