[
    {
        "id": 1,
        "schema1": {
            "anyOf": [
                {
                    "$ref": "https://json-schema.org/draft/future/schema"
                },
                {
                    "not": {
                        "$ref": "https://json-schema.org/draft/future/schema"
                    }
                }
            ]
        },
        "schema2": true,
        "tests": {
            "s1SubsetEqOfs2": true,
            "s2SubsetEqOfs1": true
        }
    }
]