[
    {
        "id": 1,
        "schema1": {
            "const": [
                3,
                4,
                5
            ]
        },
        "schema2": {
            "not": {
                "contains": {
                    "minimum": 5
                }
            }
        },
        "tests": {
            "s1SubsetEqOfs2": false
        }
    },
    {
        "id": 2,
        "schema1": {
            "const": [
                3,
                4,
                6
            ]
        },
        "schema2": {
            "not": {
                "contains": {
                    "minimum": 5
                }
            }
        },
        "tests": {
            "s1SubsetEqOfs2": false
        }
    },
    {
        "id": 3,
        "schema1": {
            "const": [
                3,
                4,
                5,
                6
            ]
        },
        "schema2": {
            "not": {
                "contains": {
                    "minimum": 5
                }
            }
        },
        "tests": {
            "s1SubsetEqOfs2": false
        }
    },
    {
        "id": 4,
        "schema1": {
            "const": {
                "a": 3,
                "b": 4,
                "c": 5
            }
        },
        "schema2": {
            "not": {
                "contains": {
                    "minimum": 5
                }
            }
        },
        "tests": {
            "s1SubsetEqOfs2": false
        }
    },
    {
        "id": 5,
        "schema1": {
            "const": {
                "a": 3,
                "b": 4,
                "c": 6
            }
        },
        "schema2": {
            "not": {
                "contains": {
                    "minimum": 5
                }
            }
        },
        "tests": {
            "s1SubsetEqOfs2": false
        }
    },
    {
        "id": 6,
        "schema1": {
            "const": {
                "a": 3,
                "b": 4,
                "c": 5,
                "d": 6
            }
        },
        "schema2": {
            "not": {
                "contains": {
                    "minimum": 5
                }
            }
        },
        "tests": {
            "s1SubsetEqOfs2": false
        }
    },
    {
        "id": 7,
        "schema1": {
            "const": 42
        },
        "schema2": {
            "not": {
                "contains": {
                    "minimum": 5
                }
            }
        },
        "tests": {
            "s1SubsetEqOfs2": false
        }
    },
    {
        "id": 8,
        "schema1": {
            "const": [
                3,
                4,
                5
            ]
        },
        "schema2": {
            "not": {
                "contains": {
                    "const": 5
                }
            }
        },
        "tests": {
            "s1SubsetEqOfs2": false
        }
    },
    {
        "id": 9,
        "schema1": {
            "const": [
                3,
                4,
                5,
                5
            ]
        },
        "schema2": {
            "not": {
                "contains": {
                    "const": 5
                }
            }
        },
        "tests": {
            "s1SubsetEqOfs2": false
        }
    },
    {
        "id": 10,
        "schema1": {
            "const": {
                "a": 3,
                "b": 4,
                "c": 5
            }
        },
        "schema2": {
            "not": {
                "contains": {
                    "const": 5
                }
            }
        },
        "tests": {
            "s1SubsetEqOfs2": false
        }
    },
    {
        "id": 11,
        "schema1": {
            "const": {
                "a": 3,
                "b": 4,
                "c": 5,
                "d": 5
            }
        },
        "schema2": {
            "not": {
                "contains": {
                    "const": 5
                }
            }
        },
        "tests": {
            "s1SubsetEqOfs2": false
        }
    },
    {
        "id": 12,
        "schema1": {
            "const": [
                "foo"
            ]
        },
        "schema2": {
            "not": {
                "contains": true
            }
        },
        "tests": {
            "s1SubsetEqOfs2": false
        }
    },
    {
        "id": 13,
        "schema1": {
            "const": {
                "a": "foo"
            }
        },
        "schema2": {
            "not": {
                "contains": true
            }
        },
        "tests": {
            "s1SubsetEqOfs2": false
        }
    },
    {
        "id": 14,
        "schema1": {
            "const": "contains does not apply to strings"
        },
        "schema2": {
            "not": {
                "contains": false
            }
        },
        "tests": {
            "s1SubsetEqOfs2": false
        }
    },
    {
        "id": 15,
        "schema1": {
            "const": [
                6,
                12
            ]
        },
        "schema2": {
            "not": {
                "additionalProperties": {
                    "multipleOf": 2
                },
                "items": {
                    "multipleOf": 2
                },
                "contains": {
                    "multipleOf": 3
                }
            }
        },
        "tests": {
            "s1SubsetEqOfs2": false
        }
    },
    {
        "id": 16,
        "schema1": {
            "const": {
                "a": 6,
                "b": 12
            }
        },
        "schema2": {
            "not": {
                "additionalProperties": {
                    "multipleOf": 2
                },
                "items": {
                    "multipleOf": 2
                },
                "contains": {
                    "multipleOf": 3
                }
            }
        },
        "tests": {
            "s1SubsetEqOfs2": false
        }
    },
    {
        "id": 17,
        "schema1": {
            "const": [
                "foo"
            ]
        },
        "schema2": {
            "not": {
                "contains": {
                    "if": false,
                    "else": true
                }
            }
        },
        "tests": {
            "s1SubsetEqOfs2": false
        }
    },
    {
        "id": 18,
        "schema1": {
            "const": {
                "a": "foo"
            }
        },
        "schema2": {
            "not": {
                "contains": {
                    "if": false,
                    "else": true
                }
            }
        },
        "tests": {
            "s1SubsetEqOfs2": false
        }
    }
]