[
    {
        "id": 1,
        "schema1": {
            "const": "08:30:06Z"
        },
        "schema2": {
            "not": {
                "format": "time"
            }
        },
        "tests": {
            "s1SubsetEqOfs2": false
        }
    },
    {
        "id": 2,
        "schema1": {
            "const": "23:59:60Z"
        },
        "schema2": {
            "not": {
                "format": "time"
            }
        },
        "tests": {
            "s1SubsetEqOfs2": false
        }
    },
    {
        "id": 3,
        "schema1": {
            "const": "15:59:60-08:00"
        },
        "schema2": {
            "not": {
                "format": "time"
            }
        },
        "tests": {
            "s1SubsetEqOfs2": false
        }
    },
    {
        "id": 4,
        "schema1": {
            "const": "23:20:50.52Z"
        },
        "schema2": {
            "not": {
                "format": "time"
            }
        },
        "tests": {
            "s1SubsetEqOfs2": false
        }
    },
    {
        "id": 5,
        "schema1": {
            "const": "08:30:06.283185Z"
        },
        "schema2": {
            "not": {
                "format": "time"
            }
        },
        "tests": {
            "s1SubsetEqOfs2": false
        }
    },
    {
        "id": 6,
        "schema1": {
            "const": "08:30:06+00:20"
        },
        "schema2": {
            "not": {
                "format": "time"
            }
        },
        "tests": {
            "s1SubsetEqOfs2": false
        }
    },
    {
        "id": 7,
        "schema1": {
            "const": "08:30:06-08:00"
        },
        "schema2": {
            "not": {
                "format": "time"
            }
        },
        "tests": {
            "s1SubsetEqOfs2": false
        }
    },
    {
        "id": 8,
        "schema1": {
            "const": "08:30:06z"
        },
        "schema2": {
            "not": {
                "format": "time"
            }
        },
        "tests": {
            "s1SubsetEqOfs2": false
        }
    }
]