[
    {
        "id": 1,
        "schema1": {
            "const": [
                1
            ]
        },
        "schema2": {
            "maxContains": 1
        },
        "tests": {
            "s1SubsetEqOfs2": true
        }
    },
    {
        "id": 2,
        "schema1": {
            "const": [
                1,
                2
            ]
        },
        "schema2": {
            "maxContains": 1
        },
        "tests": {
            "s1SubsetEqOfs2": true
        }
    },
    {
        "id": 3,
        "schema1": {
            "const": {
                "a": 1
            }
        },
        "schema2": {
            "maxContains": 1
        },
        "tests": {
            "s1SubsetEqOfs2": true
        }
    },
    {
        "id": 4,
        "schema1": {
            "const": {
                "a": 1,
                "b": 2
            }
        },
        "schema2": {
            "maxContains": 1
        },
        "tests": {
            "s1SubsetEqOfs2": true
        }
    },
    {
        "id": 5,
        "schema1": {
            "const": []
        },
        "schema2": {
            "contains": {
                "const": 1
            },
            "maxContains": 1
        },
        "tests": {
            "s1SubsetEqOfs2": false
        }
    },
    {
        "id": 6,
        "schema1": {
            "const": [
                1
            ]
        },
        "schema2": {
            "contains": {
                "const": 1
            },
            "maxContains": 1
        },
        "tests": {
            "s1SubsetEqOfs2": true
        }
    },
    {
        "id": 7,
        "schema1": {
            "const": [
                1,
                1
            ]
        },
        "schema2": {
            "contains": {
                "const": 1
            },
            "maxContains": 1
        },
        "tests": {
            "s1SubsetEqOfs2": false
        }
    },
    {
        "id": 8,
        "schema1": {
            "const": [
                1,
                2
            ]
        },
        "schema2": {
            "contains": {
                "const": 1
            },
            "maxContains": 1
        },
        "tests": {
            "s1SubsetEqOfs2": true
        }
    },
    {
        "id": 9,
        "schema1": {
            "const": [
                1,
                2,
                1
            ]
        },
        "schema2": {
            "contains": {
                "const": 1
            },
            "maxContains": 1
        },
        "tests": {
            "s1SubsetEqOfs2": false
        }
    },
    {
        "id": 10,
        "schema1": {
            "const": {}
        },
        "schema2": {
            "contains": {
                "const": 1
            },
            "maxContains": 1
        },
        "tests": {
            "s1SubsetEqOfs2": false
        }
    },
    {
        "id": 11,
        "schema1": {
            "const": {
                "a": 1
            }
        },
        "schema2": {
            "contains": {
                "const": 1
            },
            "maxContains": 1
        },
        "tests": {
            "s1SubsetEqOfs2": true
        }
    },
    {
        "id": 12,
        "schema1": {
            "const": {
                "a": 1,
                "b": 1
            }
        },
        "schema2": {
            "contains": {
                "const": 1
            },
            "maxContains": 1
        },
        "tests": {
            "s1SubsetEqOfs2": false
        }
    },
    {
        "id": 13,
        "schema1": {
            "const": {
                "a": 1,
                "b": 2
            }
        },
        "schema2": {
            "contains": {
                "const": 1
            },
            "maxContains": 1
        },
        "tests": {
            "s1SubsetEqOfs2": true
        }
    },
    {
        "id": 14,
        "schema1": {
            "const": {
                "a": 1,
                "b": 2,
                "c": 1
            }
        },
        "schema2": {
            "contains": {
                "const": 1
            },
            "maxContains": 1
        },
        "tests": {
            "s1SubsetEqOfs2": false
        }
    },
    {
        "id": 15,
        "schema1": {
            "const": []
        },
        "schema2": {
            "contains": {
                "const": 1
            },
            "minContains": 1,
            "maxContains": 3
        },
        "tests": {
            "s1SubsetEqOfs2": false
        }
    },
    {
        "id": 16,
        "schema1": {
            "const": [
                1,
                1
            ]
        },
        "schema2": {
            "contains": {
                "const": 1
            },
            "minContains": 1,
            "maxContains": 3
        },
        "tests": {
            "s1SubsetEqOfs2": true
        }
    },
    {
        "id": 17,
        "schema1": {
            "const": [
                1,
                1,
                1,
                1
            ]
        },
        "schema2": {
            "contains": {
                "const": 1
            },
            "minContains": 1,
            "maxContains": 3
        },
        "tests": {
            "s1SubsetEqOfs2": false
        }
    },
    {
        "id": 18,
        "schema1": {
            "const": {}
        },
        "schema2": {
            "contains": {
                "const": 1
            },
            "minContains": 1,
            "maxContains": 3
        },
        "tests": {
            "s1SubsetEqOfs2": false
        }
    },
    {
        "id": 19,
        "schema1": {
            "const": {
                "a": 1,
                "b": 1
            }
        },
        "schema2": {
            "contains": {
                "const": 1
            },
            "minContains": 1,
            "maxContains": 3
        },
        "tests": {
            "s1SubsetEqOfs2": true
        }
    },
    {
        "id": 20,
        "schema1": {
            "const": {
                "a": 1,
                "b": 1,
                "c": 1,
                "d": 1
            }
        },
        "schema2": {
            "contains": {
                "const": 1
            },
            "minContains": 1,
            "maxContains": 3
        },
        "tests": {
            "s1SubsetEqOfs2": false
        }
    }
]