[
    {
        "id": 1,
        "schema1": {
            "anyOf": [
                {
                    "const": [
                        1
                    ]
                },
                {
                    "const": [
                        1,
                        2
                    ]
                },
                {
                    "const": {
                        "a": 1
                    }
                },
                {
                    "const": {
                        "a": 1,
                        "b": 2
                    }
                }
            ]
        },
        "schema2": {
            "maxContains": 1
        },
        "tests": {
            "s1SubsetEqOfs2": true
        }
    },
    {
        "id": 2,
        "schema1": {
            "anyOf": [
                {
                    "const": [
                        1
                    ]
                },
                {
                    "const": [
                        1,
                        2
                    ]
                },
                {
                    "const": {
                        "a": 1
                    }
                },
                {
                    "const": {
                        "a": 1,
                        "b": 2
                    }
                }
            ]
        },
        "schema2": {
            "contains": {
                "const": 1
            },
            "maxContains": 1
        },
        "tests": {
            "s1SubsetEqOfs2": true
        }
    },
    {
        "id": 3,
        "schema1": {
            "anyOf": [
                {
                    "const": [
                        1,
                        1
                    ]
                },
                {
                    "const": {
                        "a": 1,
                        "b": 1
                    }
                }
            ]
        },
        "schema2": {
            "contains": {
                "const": 1
            },
            "minContains": 1,
            "maxContains": 3
        },
        "tests": {
            "s1SubsetEqOfs2": true
        }
    }
]