[
    {
        "id": 1,
        "schema1": {
            "const": {
                "$defs": {
                    "foo": {
                        "type": "integer"
                    }
                }
            }
        },
        "schema2": {
            "$ref": "https://json-schema.org/draft/future/schema"
        },
        "tests": {
            "s1SubsetEqOfs2": true
        }
    },
    {
        "id": 2,
        "schema1": {
            "const": {
                "$defs": {
                    "foo": {
                        "type": 1
                    }
                }
            }
        },
        "schema2": {
            "$ref": "https://json-schema.org/draft/future/schema"
        },
        "tests": {
            "s1SubsetEqOfs2": false
        }
    }
]