[
    {
        "id": 1,
        "schema1": {
            "const": "1"
        },
        "schema2": {
            "format": "relative-json-pointer"
        },
        "tests": {
            "s1SubsetEqOfs2": true
        }
    },
    {
        "id": 2,
        "schema1": {
            "const": "0/foo/bar"
        },
        "schema2": {
            "format": "relative-json-pointer"
        },
        "tests": {
            "s1SubsetEqOfs2": true
        }
    },
    {
        "id": 3,
        "schema1": {
            "const": "2/0/baz/1/zip"
        },
        "schema2": {
            "format": "relative-json-pointer"
        },
        "tests": {
            "s1SubsetEqOfs2": true
        }
    },
    {
        "id": 4,
        "schema1": {
            "const": "0#"
        },
        "schema2": {
            "format": "relative-json-pointer"
        },
        "tests": {
            "s1SubsetEqOfs2": true
        }
    },
    {
        "id": 5,
        "schema1": {
            "const": "/foo/bar"
        },
        "schema2": {
            "format": "relative-json-pointer"
        },
        "tests": {
            "s1SubsetEqOfs2": false
        }
    },
    {
        "id": 6,
        "schema1": {
            "const": "-1/foo/bar"
        },
        "schema2": {
            "format": "relative-json-pointer"
        },
        "tests": {
            "s1SubsetEqOfs2": false
        }
    }
]