[
    {
        "id": 1,
        "schema1": {
            "const": [
                1
            ]
        },
        "schema2": {
            "not": {
                "maxContains": 1
            }
        },
        "tests": {
            "s1SubsetEqOfs2": false
        }
    },
    {
        "id": 2,
        "schema1": {
            "const": [
                1,
                2
            ]
        },
        "schema2": {
            "not": {
                "maxContains": 1
            }
        },
        "tests": {
            "s1SubsetEqOfs2": false
        }
    },
    {
        "id": 3,
        "schema1": {
            "const": {
                "a": 1
            }
        },
        "schema2": {
            "not": {
                "maxContains": 1
            }
        },
        "tests": {
            "s1SubsetEqOfs2": false
        }
    },
    {
        "id": 4,
        "schema1": {
            "const": {
                "a": 1,
                "b": 2
            }
        },
        "schema2": {
            "not": {
                "maxContains": 1
            }
        },
        "tests": {
            "s1SubsetEqOfs2": false
        }
    },
    {
        "id": 5,
        "schema1": {
            "const": [
                1
            ]
        },
        "schema2": {
            "not": {
                "contains": {
                    "const": 1
                },
                "maxContains": 1
            }
        },
        "tests": {
            "s1SubsetEqOfs2": false
        }
    },
    {
        "id": 6,
        "schema1": {
            "const": [
                1,
                2
            ]
        },
        "schema2": {
            "not": {
                "contains": {
                    "const": 1
                },
                "maxContains": 1
            }
        },
        "tests": {
            "s1SubsetEqOfs2": false
        }
    },
    {
        "id": 7,
        "schema1": {
            "const": {
                "a": 1
            }
        },
        "schema2": {
            "not": {
                "contains": {
                    "const": 1
                },
                "maxContains": 1
            }
        },
        "tests": {
            "s1SubsetEqOfs2": false
        }
    },
    {
        "id": 8,
        "schema1": {
            "const": {
                "a": 1,
                "b": 2
            }
        },
        "schema2": {
            "not": {
                "contains": {
                    "const": 1
                },
                "maxContains": 1
            }
        },
        "tests": {
            "s1SubsetEqOfs2": false
        }
    },
    {
        "id": 9,
        "schema1": {
            "const": [
                1,
                1
            ]
        },
        "schema2": {
            "not": {
                "contains": {
                    "const": 1
                },
                "minContains": 1,
                "maxContains": 3
            }
        },
        "tests": {
            "s1SubsetEqOfs2": false
        }
    },
    {
        "id": 10,
        "schema1": {
            "const": {
                "a": 1,
                "b": 1
            }
        },
        "schema2": {
            "not": {
                "contains": {
                    "const": 1
                },
                "minContains": 1,
                "maxContains": 3
            }
        },
        "tests": {
            "s1SubsetEqOfs2": false
        }
    }
]